Headlines,Time,Description
"Everything Jim Cramer said on 'Mad Money,' including stocks for kids, Starbucks hiring veterans",2019-11-08,"CNBC's Jim Cramer says Disney and Nvidia are two stocks to put in your kid's portfolio. The ""Mad Money"" host also hears from Starbucks CEO Kevin Johnson on hiring veterans."
Cramer's lightning round: Microsoft is on its way to $150,2019-11-08,Jim Cramer takes stock questions from and gives his thoughts to military members at the U.S. Airforce Academy in Colorado in a special version of the lightning round.
$9 billion money manager who called record run predicts more new highs for 2019,2019-11-08,"The S&P 500 could see even more new highs this year, says Avalon Investment & Advisory Chief Investment Officer and Portfolio Manager Bill Stone."
"Starbucks CEO: We plan to hire 5,000 veterans annually",2019-11-08,"""They make us a better company,"" Starbucks CEO Kevin Johnson tells Jim Cramer on ""Mad Money."""
Two stocks Jim Cramer says you should add to your kid's portfolio,2019-11-08,"The ""Mad Money"" host says to start your child's stock portfolio with shares of Disney and Nvidia."
"This trend 'can help take us to new highs' this year, says investor",2019-11-08,"The S&P 500 could see even more new highs this year, says Avalon Investment & Advisory Chief Investment Officer and Portfolio Manager Bill Stone."
"TJX, Ross, Burlington are beneficiaries of 'roadkill losers in the mall,' Jim Cramer says",2019-11-08,"Shopping center landlords don't have to worry about off-price retailers going under the next time we have a recession, the ""Mad Money"" host says."
$9 billion money manager who called record run sees new highs ahead,2019-11-10,"The S&P 500 could see even more new highs this year, says Avalon Investment & Advisory's investment chief Bill Stone."
"Norwegian Cruise is taking the environment 'seriously' by eliminating plastic water bottles, CEO says",2019-11-11,"""We ply the ocean's waters. We do everything we possibly can ... to prevent any kind of pollution in the water or in the air,"" CEO Frank Del Rio tells Jim Cramer."
Cramer's lighting round: The fossil fuels sector is in the house of pain,2019-11-11,"""Mad Money"" host Jim Cramer rings the lightning round bell, which means he's giving his answers to callers' stock questions at rapid speed."
"The bulls are 'running circles around' the bears, Jim Cramer says",2019-11-11,"""This market just keeps surprising us with companies that are doing better than anyone could've imagined, or at least their stocks were cheaper than we thought,"" the ""Mad Money"" host says."
"The problem with income inequality is not CEO pay  Eit's everybody else's, Jim Cramer says",2019-11-11,"""Income inequality is a real problem in this country … but the problem is not CEO pay. I think it might be everybody else's pay,"" the ""Mad Money"" host says."
"Everything Jim Cramer said on 'Mad Money,' including bear woes, CEO pay",2019-11-11,"CNBC's Jim Cramer breaks down what bear investors are getting wrong about the market, sits down with Norwegian Cruise Line CEO Frank Del Rio on its new ship, explains why there could be more room for the market to run and defends CEO pay."
"I doubt the stock market can absorb much higher tariffs, Jim Cramer says",2019-11-12,"""If the Chinese really are eager to make a deal, well that would give the averages a major boost,"" the ""Mad Money"" host says."
Cramer's lightning round: I won't rule out this gold company's stock,2019-11-12,"""Mad Money"" host Jim Cramer rings the lightning round bell, which means he's giving his answers to callers' stock questions at rapid speed."
"PayPal CFO: Military veterans have leadership, teamwork skills that 'make us a much better company'",2019-11-12,"""When employers look at the qualities that they want in candidates, military veterans have honed some of those skills in their career,"" PayPal CFO John Rainey says."
"Everything Jim Cramer said on 'Mad Money,' including Disney+ stats, buying Peloton, 5G rollout, Dexcom",2019-11-13,"CNBC's Jim Cramer hails Bob Iger's leadership at Disney, explains the right time to buy shares of Peloton, sits down for an interview with Dexcom CEO Kevin Sayer and breaks down the 5G rollout."
Cramer's lightning round: I want you to own Coca-Cola,2019-11-13,"It's that time again! ""Mad Money"" host Jim Cramer rings the lightning round bell, which means he's giving his answers to callers' stock questions at rapid speed."
"Everything Jim Cramer said on 'Mad Money,' including Trump tariff threat, PayPal and RealReal execs",2019-11-13,CNBC's Jim Cramer flags that the stock market would not be able to absorb another tariff increase on Chinese imports. He sits down with RealReal CEO Julie Wainwright to talk about the company's product authentication process and chats with PayPal CFO.
The RealReal CEO says: 'We keep changing' to fend off fakes,2019-11-13,"The RealReal is constantly updating its operations in an effort to prevent and remove counterfeit products from its website, founder and CEO Julie Wainwright told CNBC Tuesday."
"Big Data is the 'next frontier' for medicine, says Dexcom CEO",2019-11-13,"""When you can do things like that, and deliver results like that with a system, you're really solving a very serious problem,"" DexCom CEO Kevin Sayer says."
"Everything Jim Cramer said on 'Mad Money,' including Cisco's quarter, Viacom CEO, trade war divides",2019-11-14,"CNBC's Jim Cramer breaks down how Cisco's stock woes reflect other tech stocks, sits down with Viacom CEO Bob Bakish to talk streaming and the merger with CBS, and explains why the U.S.-China trade war could be at risk of dragging for years."
Cramer: Ideological divides could make the US-China trade war 'go on for years',2019-11-14,"""If I were the Chinese, I would rather deal with Trump now, than Trump or Warren later,"" the ""Mad Money"" host says."
"Investors should wait for Peloton shares to get hit in early 2020 and then 'pounce,' Jim Cramer says",2019-11-14,Jim Cramer suggests holding off from buying shares of exercise equipment manufacturer Peloton until after its lockup on insider trading expires in Mar.
"Jim Cramer: Cisco, enterprise tech stocks 'turned into market punching bags'",2019-11-14,"""The market wants nothing to do with tech companies that serve the enterprise, but ... it loves the consumer,"" the ""Mad Money"" host says."
Viacom CEO: We will bring a 'different approach' to compete in streaming,2019-11-14,"When Viacom and CBS merge in December, the reunited entity will combine ""free and paid"" products to reach ""the widest accessible market,"" Bob Bakish tells Jim Cramer."
"Disney shares have more upside, 'even after today's phenomenal run,' Jim Cramer says",2019-11-14,"""Not long ago, Iger told me 'we're just getting started,' and I say 'it's still not too late to join him on his ride of a lifetime,'"" the ""Mad Money"" host says."
Cramer's lightning round: I want you to buy CVS,2019-11-14,"""Mad Money"" host Jim Cramer rings the lightning round bell, which means he's giving his answers to callers' stock questions at rapid speed."
"Cramer's week ahead: Home Depot, Target and Macy's earnings  Eplus US-China trade developments",2019-11-15,"The ""Mad Money"" host explains what he will monitor closely next week, including earnings reports from Kohl's and Foot Locker. He's also watching for news in the U.S.-China trade war."
"Artificial intelligence has become a driving force in everyday life, says LivePerson CEO",2019-11-15,"""We're one of the few companies where it's not a piece of the puzzle. It's the entire puzzle,"" LivePerson CEO Robert LoCascio says."
Cramer's lightning round: I'm a buyer of Wells Fargo,2019-11-15,"The ""Mad Money"" host also says that he would not recommend buying any pipeline stocks. But if you own a company such as Kinder Morgan, ""you don't have to get rid of it."""
"Everything Jim Cramer said on 'Mad Money,' including upcoming earnings and Walmart",2019-11-18,"The ""Mad Money"" host offers his early take on next week's earnings reports, while also learning about how artificial intelligence is changing how customers interact with brands from LivePerson's CEO."
"'When tech stocks go down they're not necessarily out,' Jim Cramer says",2019-11-18,"Jim Cramer says it's ""crazy"" to sell semiconductor stocks such as AMD and Nvidia ""when they report good quarters with a tiny bit of irrelevant hair on them."""
Levi's CEO: 'The best innovation happens when you've got constraints',2019-11-18,"""Completely unconstrained, an innovation organization can just get lost in the weeds,"" Chip Bergh says on ""Mad Money."""
"Airbnb could choose direct listing over IPO in 2020  E'We don't need the money,' CEO says",2019-11-18,"Most companies rushing to public markets ""need the money. We don't need to raise money and so we haven't been in a rush,"" Airbnb CEO Brian Chesky says."
Cramer's lightning round: Cannabis ETFs have pulled down GW Pharma,2019-11-18,"""Mad Money"" host Jim Cramer rings the lightning round bell, which means he's giving his answers to callers' stock questions at rapid speed."
"Everything Jim Cramer said on 'Mad Money,' including trade hits to tech stocks, Salesforce CEO interview",2019-11-19,"CNBC's Jim Cramer advises investors not to give up software-as-a-service plays, despite boiling trade tensions. The ""Mad Money"" host sits down for interviews with executives of Salesforce, Square and RH."
Cramer's lightning round: I say buy American Tower,2019-11-19,"""Mad Money"" host Jim Cramer rings the lightning round bell, which means he's giving his answers to callers' stock questions at rapid speed."
Salesforce's Marc Benioff introduces Customer 360 Truth: The 'computer science holy grail',2019-11-19,"""Now we're entering the fourth stage of computing. It's the pursuit of [the stage known as] single source of truth, and we've built that into our platform,"" Marc Benioff tells CNBC's Jim Cramer."
"Selling software service stocks on trade worries is a 'big mistake,' Jim Cramer says",2019-11-19,"Software-as-a-service stocks ""tend to come bouncing back with alacrity because these companies are forces of nature,"" ""Mad Money's"" Jim Cramer says."
"Everything Jim Cramer said on 'Mad Money,' including retail earnings, Okta and Tableau Software CEOs",2019-11-20,"CNBC's Jim Cramer breaks down the strengths and weakness behind the earnings reports in Home Depot, Lowe's, Kohl's and Target. The ""Mad Money"" host sits down with the CEOs of Okta and Tableau to get insight into the impact of technology on businesses."
"Digital was key difference in rivals Home Depot, Lowe's quarterly reports, Jim Cramer says",2019-11-20,"""These days, people expect everything to be frictionless. The moment they hit any kind of problem, any speed bump, they just take their business elsewhere,"" the ""Mad Money"" host says."
"Retailers such as Kohl's 'in trouble' without better digital presence or bargains, Cramer says",2019-11-20,"""Wait for the next round of tariff hikes or nasty trade rhetoric ... to knock down the whole group, and then buy the retail winners,"" Jim Cramer says."
Cramer's lightning round: I do believe that AT&T is a good stock,2019-11-20,"""Mad Money"" host Jim Cramer rings the lightning round bell, which means he's giving his answers to callers' stock questions at rapid speed."
"Facts show talk of recession is way overblown, United Airlines CEO says",2019-11-21,"""I've never seen a wider gap between what is being discussed and trying to be pushed and the facts and the figures that we see,"" Oscar Munoz says."
Jim Cramer: Robinhood pushed Charles Schwab to deal for TD Ameritrade,2019-11-21,"""These companies have to combine to cut tech spending ... ad spending to defend their turf"" from app trading, ""Mad Money"" host Jim Cramer says."
Cramer's lightning round: Lululemon will be one of the 'retail survivors',2019-11-21,"""Mad Money"" host Jim Cramer rings the lightning round bell, which means he's giving his answers to callers' stock questions at rapid speed."
"'We've been in this slow melt higher,' technical analyst says",2019-11-22,"JC O'Hara, chief market technician at MKM Partners, and Steve Chiavarone, equity strategist, vice president and portfolio manager at Federated, discuss what's ahead for stocks with CNBC's Mike Santoli."
Cramer's week ahead: A short week on Wall Street stuffed with earnings reports,2019-11-22,"""Will the president slaughter a turkey this year, or slaughter the market? I bet he goes for the former,"" ""Mad Money's"" Jim Cramer says."
Clorox CEO: What is good for the environment is good for business,2019-11-22,"""We want to reduce the virgin plastic and fiber that we use in our products and packaging by 50% over the next 10 years,"" Clorox CEO Benno Dorer says."
Cramer's lightning round: Let Tesla shares come down more before buying,2019-11-22,"""Mad Money"" host Jim Cramer rings the lightning round bell, which means he's giving his answers to callers' stock questions at rapid speed."
"Everything Jim Cramer said on 'Mad Money,' including trade war progress, Clorox and SoFi CEOs",2019-11-22,CNBC's Jim Cramer takes a look at a shortened week of Wall Street that's full of earnings reports heading into the Thanksgiving holiday. He sits down with the CEOs of Clorox and fintech disruptor SoFi.
Credit Suisse sees almost 10% upside in the S&P 500 in 2020,2019-11-25,"Jonathan Golub of Credit Suisse says the S&P 500 could move up toward 3,425 in 2020 because of a better economic backdrop and improved earnings. He also says he's not expecting a ""wonderful"" trade deal to lift markets and his optimism is not trade dependent."
"Everything Jim Cramer said on 'Mad Money,' including mergers, buy Uber, PVH CEO and sell Sonos",2019-11-25,"CNBC's Jim Cramer explains what the recent mergers tell us about the stock market. The ""Mad Money"" host also explains why now is the right time to buy shares of Uber."
Cramer's lightning round: Take profits and sell some shares of Sonos,2019-11-25,"The ""Mad Money"" host also recommends buying shares of Costco when its stock pulls back. He also does not recommend Molson Coors Brewing Company."
CEO of Calvin Klein owner warns China tariffs could soon hit US economy in a meaningful way,2019-11-25,"The uncertainty of the U.S.-China trade war has been the biggest hindrance to business, PVH CEO Emanuel Chirico said."
"Sell the pot stocks  Ethe market is 'not what it was cracked up to be,' Jim Cramer says",2019-11-25,"""Companies need to close, funding needs to dry up, mergers must occur. Until then, these stocks are now sell-in-the-strength detritus,"" the ""Mad Money"" host says."
Cramer: Recent mergers show stocks are not as expensive as people think,2019-11-25,"If stocks were actually overpriced, there would not be as much merger and acquisition activity, the ""Mad Money"" host says."
"Shares of Uber are now worth buying, Jim Cramer says",2019-11-25,"The ""Mad Money"" host has been skeptical of Uber, but he believes there is a clear path for its stock to go higher."
"Everything Jim Cramer said on 'Mad Money,' including Schwab-TD Ameritrade talks, weed stocks",2019-11-25,"CNBC's Jim Cramer explains what triggered Charles Schwab and TD Ameritrade brokerages to discuss a merger, tells investors it's time to sell marijuana stocks and sits down with the CEOs of United Airlines and Advanced Micro Devices."
"The S&P 500's chart is signaling a near-term pullback, technical analyst warns",2019-11-25,"The last time the S&P 500's chart showed this, stocks pulled back shortly thereafter, says JC O'Hara, chief market technician at MKM Partners."
How 3D printing company Carbon is trying to shape the future of manufacturing,2019-11-26,"""This has been an area that's been around for 25, 30 years ... We've cracked the code on how to do 3D printing 100 to 1,000 times faster,"" Carbon's Joseph DeSimone says."
"Cramer: The stock market will continue rallying despite trade war, impeachment and other concerns",2019-11-26,"The ""Mad Money"" host explains that the stock market has remained strong because tariffs haven't been as impactful as expected, sensible mergers have been announced and employment remains robust."
Zappos CEO says trade war tariffs haven't impacted pricing yet,2019-11-26,"Even if tariffs end up putting pressure on Zappos, Hsieh said he believes its loyal customers would continue shopping with the company due to its commitment to customer service."
Lightning Round Contemplate,2019-11-26,"The ""Mad Money"" host says FedEx is too cheap right now, and he also recommended taking some shares of Arrowhead Pharmaceuticals off the table."
"Everything Jim Cramer said on 'Mad Money,' including market rally, Robinhood impact and Zappos CEO",2019-11-26,"The ""Mad Money"" host explains why the stock market has kept rallying despite some concerns. He also discusses Robinhood's impact on investing and talks tariff impact with the CEO of Zappos."
Cramer Remix: The biggest mistake investors can make with taxes,2019-11-27,Jim Cramer reveals his top rule when it comes to taxes and selling stocks.
Owning too many stocks and not enough cash can set you up for failure: Cramer,2019-11-27,"Jim Cramer breaks down why owning fewer stocks can help make you more money, and why investors shouldn't be ashamed of having cash on hand."
Cramer: I helped investors through the 2010 flash crash by following one key rule,2019-11-27,"Jim Cramer builds on his ""nobody ever made a dime panicking"" mantra by explaining how investors can apply it to their portfolios."
"Cramer's top 2 investing rules for bulls, bears and everyone in between",2019-11-27,Jim Cramer shares the two most important investing rules he has learned after nearly 40 years in the business.
Agnico Eagle CEO: There won't be a 'substantial' number of new gold mines built,2019-11-27,"""It's a lot tougher now than it was 10 or 15 years ago,"" Agnico Eagle Mines' Sean Boyd says."
"Never buy a stock all at once  Eyou'll almost definitely get burned, says Jim Cramer",2019-11-27,Jim Cramer doubles down on his key investing rule of never buying a desired stock all in one go.
Cramer: Warren's backtrack on 'Medicare for All' is a boon for this managed-care stock,2019-12-02,"UnitedHealth's stock has ""caught fire"" due in part to Sen. Elizabeth Warren appearing to ""back away"" from her ""Medicare for All"" proposal, according to Jim Cramer."
"Charts show stocks will face pressure through most of Q1 2020, Jim Cramer says",2019-12-02,"Investors are turning from bullish to bearish and Larry Williams suggests investors ""try to sidestep the pain here,"" the ""Mad Money"" host says."
Jim Cramer: We need more 'negativity' in the market before you can start buying again,2019-12-02,"""Once people start worrying again, stocks will come down to more reasonable levels and then you can pounce, but we're not there yet,"" the ""Mad Money"" host says."
Cramer's lightning round: I think you want to sell some Caterpillar,2019-12-02,"""Mad Money"" host Jim Cramer gives callers his thoughts on the stocks of Biogen, Amgen, Caterpillar and others in rapid speed."
"Everything Jim Cramer said on 'Mad Money,' including bearish feels, 'Medicare for All,' S&P forecast",2019-12-02,"""Mad Money's"" Jim Cramer says stocks need to come down more before they're safe to buy again, breaks down the latest developments in managed-care stocks and explains why Wall Street could be under pressure in coming months."
Cramer's lightning round: Tobacco stocks don't deserve your money,2019-12-03,"""Mad Money"" host Jim Cramer rings the lightning round bell, which means he's giving his answers to callers' stock questions at rapid speed."
Salesforce co-CEO Keith Block downplays profit forecastguidance cut: 'Business looks strong',2019-12-03,"""We had a great quarter. We have a lot of success,"" Salesforce co-CEO Keith Block tells Jim Cramer."
Jim Cramer: China trade is a 'much smaller issue' on the market than most people realize,2019-12-03,"Trade fears ""will eventually create fabulous discounts"" in the stock market, but ""we're not totally there yet,"" the ""Mad Money"" host says."
The US markets are 'ridiculously complacent': Strategist,2019-12-03,"Kathryn Vera of Bulltick Capital Markets says the U.S. markets are complacent about domestic politics, Fed policy and the trade dispute with China, and that's a cause for concern for investors"
Jim Cramer: Plan to buy these digitization plays 'on the way down',2019-12-04,"""The companies being thrown away are those that are surfing the biggest secular growth story of our era: the digitization of enterprises,"" the ""Mad Money"" host says."
"The future of Mattel is about a lot more than making toys, CEO says",2019-12-04,"It includes robust footprints in areas closely related to toys such as movies, television and live events, Mattel CEO Ynon Kreiz says."
"Robinhood democratizes stocks for younger generations, co-founder says",2019-12-04,"""People are paying lower prices and that's something that's gone beyond Robinhood and is now available to tens of millions of consumers across the U.S.,"" co-CEO Vladimir Tenev says."
Cramer's lightning round: Jack Dorsey's move to Africa is 'ill-advised',2019-12-04,"""Mad Money"" host Jim Cramer rings the lightning round bell, which means he's giving his answers to callers' stock questions at rapid speed."
"Everything Jim Cramer said on 'Mad Money,' including market rotation, Robinhood's 10 million users",2019-12-04,"""Mad Money's"" Jim Cramer breaks down how big funds are shuffling their portfolios and where individual investors can pick stock. He sits down with the CEO of Mattel toy company and the co-founders of stock-trading app Robinhood."
"Everything Jim Cramer said on 'Mad Money,' including Americans not investing, Chipotle CEO",2019-12-05,"CNBC's Jim Cramer breaks down data behind the public's lack of interesting in buying stocks. The ""Mad Money"" host sits down with CEOs of Chipotle, ServiceNow and Edwards Lifesciences for interviews."
"The second food-prep line gives Chipotle a 'huge advantage' in deliveries, CEO says",2019-12-05,"Chipotle CEO Brian Niccol tells ""Mad Money"" host Jim Cramer that the second prep line prevents the process from getting ""bottlenecked."""
"Jim Cramer blames bears, media for the public's low interest in stocks",2019-12-05,"""There are vast sums of money to be made here, and far too many people are missing out because they've been frightened away,"" the ""Mad Money"" host says."
"Everything Jim Cramer said on 'Mad Money,' including China trade fears, Salesforce co-CEO",2019-12-05,"CNBC's Jim Cramer says China is a ""much smaller issue than most people seem to realize,"" chats with Salesforce co-CEO Keith Block after the cloud company's earnings and offers stock buying advice to callers."
Cramer's lightning round: Buy Wendy's ahead of its breakfast launch,2019-12-05,"""Mad Money"" host Jim Cramer rings the lightning round bell, which means he's giving his answers to callers' stock questions at rapid speed."
Cramer's week ahead: 'Amazing' jobs report gives us a break from China trade news,2019-12-06,"""When we get an amazing employment report, we can take a break from the on-again, off-again China news and just focus on earnings,"" ""Mad Money"" host Jim Cramer says."
Cramer's lightning round: Virgin Galactic is 'a bridge too far',2019-12-06,"""Mad Money"" host Jim Cramer rings the lightning round bell, which means he's giving his answers to callers' stock questions at rapid speed."
Boot Barn CEO plans to double store count to 500: Western fashion a 'massive retail opportunity',2019-12-06,"""We've said in the past that this is a massive retail opportunity that's been hidden in plain sight for years,"" Boot Barn CEO Jim Conroy says in a ""Mad Money"" interview."
Cramer: Trump should go forward with Dec. 15 tariffs,2019-12-06,"The strong November jobs report shows Trump has more flexibility in trade negotiations with China, CNBC's Jim Cramer says."
"Everything Jim Cramer said on 'Mad Money,' including looming earnings, Dec. 15 tariffs, Boot Barn",2019-12-06,"CNBC's Jim Cramer looks at the week ahead in company earnings and stock market news, sits down with Boot Barn CEO Jim Conroy to get insight into its brick-and-mortar plans and says President Trump should authorize the Dec. 15 tariff hike."
"Everything Jim Cramer said on 'Mad Money,' including Fed and tariffs, department store woes, AT&T",2019-12-09,"CNBC's Jim Cramer breaks down how investors should play Wednesday's Fed announcement, Trump's tariff hike threat on China and invest in AT&T's stock."
"Jim Cramer: Macy's, Kohl's 'have never felt more irrelevant'",2019-12-09,"""The problem for Macy's and Kohl's and Nordstrom is that ... their position gets worse and worse with every passing year,"" Jim Cramer says."
"AT&T shares can go 'much, much higher' from here if management can deliver, Jim Cramer says",2019-12-09,"A MoffettNathanson analyst last month issued a sell rating on AT&T's stock. ""Mad Money's"" Jim Cramer says the call misses the forest for the trees."
Cramer's lightning round: Ring the register on Fitbit,2019-12-09,"""Mad Money"" host Jim Cramer rings the lightning round bell, which means he's giving his answers to callers' stock questions at rapid speed."
"Jim Cramer: Be ready to buy stocks if this Fed, tariff scenario happens",2019-12-09,"If the Fed teases potential interest rate hikes and Trump follows through on higher tariffs, ""you have to be ready to buy [stocks],"" Jim Cramer says."
"Buy these 5G stock plays if they take a dip from US-China trade news, Jim Cramer says",2019-12-10,"""At a time like this, we need big apolitical themes that work no matter what, and the best of them should work for years,"" the ""Mad Money"" host says."
