Headlines,Time,Description
Cramer Remix: This defense stock had the best conference call in the sector,2019-04-26,Jim Cramer breaks down the recent strength behind Lockheed Martin's stock.
Cramer's lightning round: This grocer stock has too much competition,2019-04-26,Jim Cramer runs through his thoughts about callers' favorite stock picks of the day.
Cramer: Ford and Honeywell can withstand Uber's onslaught on the auto sector,2019-04-26,"""The auto industry just isn't a bedrock part of this economy anymore, and very few companies saw this coming,"" Jim Cramer says."
Cramer's game plan: What to expect in the week of earnings and Friday's jobs report,2019-04-26,Jim Cramer predicts that the Apr non-farm payroll report will be strong. He says it may trigger some to call for a more hawkish Federal Reserve.
"Cramer Remix: What ""Medicare for All"" would mean for UnitedHealth Group",2019-04-29,Jim Cramer breaks down what the 2020 election could mean for UnitedHealth Group.
"Cramer: Be wary of stocks that rally into earnings reports, like Google-parent Alphabet did",2019-04-29,"""A gentle dip ahead of earnings can be the best vaccination against a sell-off,"" Jim Cramer says."
3M CEO on disappointing earnings: We're getting ahead of the curve in China and weak sectors,2019-04-29,Roman blamed challenges in China as well as in the automotive and electronics sectors for the manufacturing giant's weak first quarter earnings.
Jim Cramer revisits his top stock picks for the 5G rollout,2019-04-29,"In February, he declared that Skyworks Solutions, Intel, Qualcomm, Broadcom, and Xilinx were the top five semiconductor companies that stand to benefit from the building of 5G infrastructure."
Cramer's lightning round: A medical device company should acquire this,2019-04-29,Jim Cramer takes calls from viewers and lets them know his thoughts about their stock picks in rapid speed.
Homebuilder CEO saw momentum shift in Q1: 'The consumer is definitely more engaged',2019-04-30,"TRI Pointe Homes CEO Doug Bauer says if job and wage growth remains strong, demand will continue to pick up for housing in the long run."
Cramer's lightning round: Let this stock pullback from its all-time highs before buying,2019-04-30,Jim Cramer gives callers his thoughts about their stock picks of the day in rapid speed.
"Cramer dissects Alphabet's earnings slump: 'Sloppy execution, bad salesmanship'",2019-04-30,"""It seems like this company is constitutionally incapable of admitting that they let anybody down,"" he said."
Cramer: Investors who bought Apple ahead the quarter got the call right,2019-04-30,"""Not only did Apple deliver a nice top- and bottom-line beat, but China, the major source of weakness last quarter, is turning around,"" Jim Cramer says."
Cramer Remix: Facebook and Amazon suffered from 'guilt by association' after Alphabet's revenue woes,2019-05-01,Jim Cramer details the irrational moves that sent the entire FANG cohort tumbling.
"AMD CEO: With new products launching, 2019 is a 'growth year'",2019-05-01,"""As we go three to five years forward, we have a lot of things in the hopper,"" CEO Lisa Su said."
Cramer: 'We've had a terrific run'  Eit's time to trim some positions,2019-05-01,"The stock market is in ""fine shape  Esomewhat overheated, most definitely  Ebut I still think it makes sense to stay the course,"" Jim Cramer says."
"Cramer's lighting round: The quarter won't be good, but buy this stock",2019-05-01,"It's that time again! ""Mad Money"" host Jim Cramer rings the lightning round bell, which means he's giving his answers to callers' stock questions at rapid speed."
"Cramer Remix: Own Apple, don't trade it  EThe stock could have more upside",2019-05-01,Jim Cramer breaks down how Apple's subscription model is making the stock even more enticing.
Cramer: Beyond Meat priced its IPO at $25 a share  Ebuy in below $35 after its debut,2019-05-01,"""At the midpoint of its current price range, Beyond Meat's going to be very expensive  Eit's already trading at 17-times last year's sales,"" Jim Cramer says."
Cramer breaks down why you should prepare for more market pullback,2019-05-02,"""I am pretty sanguine about this market longer-term, but the disciplined thing to do right now is to raise a little cash, prepare for a pullback"" to do more buying, Jim Cramer says."
Cramer: Don't expect the Fed to bow to Trump's interest rates demands,2019-05-02,"Jim Cramer on Thursday called it a ""lunatic theory"" to think that Fed Chair Jerome Powell should have gone along with President Donald Trump's call to cut interest rates."
"Cramer reviews the top activist stories of 2019: eBay, Dollar Tree, Bristol-Myers, Bed Bath & Beyond",2019-05-02,"""Sometimes, they reach an accommodation with management and it works. Other times they get involved in proxy fights ... and the trade falls apart,"" Jim Cramer says."
"Cramer's lightning round: Cirrus is an Apple supplier, but I wouldn't buy here",2019-05-02,"It's that time again! ""Mad Money"" host Jim Cramer rings the lightning round bell, which means he's giving his answers to callers' stock questions at rapid speed."
Cramer Remix: Occidental Petroleum's deal with Buffett is ill-advised,2019-05-03,Jim Cramer breaks down Buffett's investment in Occidental and why he thinks the company could get a better deal elsewhere.
"Cramer: Why investors must time the big funds, not the business cycle, to win in this market",2019-05-03,"""If you wait for a particular cycle to turn, you'll be too late  Eby the time there's clear evidence, you've already missed the move,"" Cramer said."
Cramer Remix: Why buybacks have not benefited Bed Bath & Beyond,2019-05-03,Jim Cramer explains how the retailer has hurt itself by spending fortunes buying back stock.
"Cramer's lightning round: IPG is inexpensive, but don't buy it here",2019-05-03,Jim Cramer zips through his takes on callers' stock picks of the day.
Cramer Remix: China needs us more than we need China,2019-05-06,"Jim Cramer explains how the United States has the upper hand in trade negotiations with our stronger, cash fueled economy."
Cramer's lightning round: FedEx got hurt by China  EBuy some in 3 days,2019-05-06,Jim Cramer takes calls and delivers his assessment of viewers stock picks in rapid speed.
"Cramer's week ahead: A red-hot market, and Uber's IPO",2019-05-06,"""We've got a runaway freight train of a market and I'd love to see the darned thing cool off for more than a session or two,"" the host said."
Ford's rebound is just getting started  Ehere's why it's the only auto Cramer endorses,2019-05-06,"""Ford no longer wants to make cars everywhere, no matter what the cost. It doesn't want a one-car-fits-all worldwide strategy,"" Jim Cram says."
Cramer: Trump's tariff threat sent investors running to domestic stocks Monday  Ethat's a good sign,2019-05-06,"""Normally when the market gets hammered, people wait around for a few days before putting their money back to work. Not today,"" Jim Cramer says."
Jim Cramer swaps Twilio for Red Hat in his 'cloud kings' group of hot tech stocks,2019-05-06,"""I'm not going to tell you that it's cheap, but I'd much rather own Twilio than these shiny new objects,"" Cramer said."
Cramer: Uber's IPO and tariffs could be the 'one-two punch' that tanks the markets Friday,2019-05-07,"""Even after today's huge losses, I am still concerned about what could happen on Friday,"" Jim Cramer says."
Cramer: Uber's fundamentals aren't great  EI wouldn't buy Friday's open,2019-05-07,"""When you look at the fundamentals, which no one is doing … there's just not much here worth getting excited about,"" Jim Cramer says."
Cramer's lightning round: Don't shift positions on Starbucks. They're in fine shape,2019-05-07,Jim Cramer zips through his responses to callers' stock picks of the day.
"Cramer Remix: There aren't enough safety zones in this market, so don't buy into the weakness",2019-05-08,Jim Cramer warns that there may be more panic  Eand selling  Eahead as fears over U.S.-China trade relations are reignited.
These 6 stocks could make or break the S&P 500's run,2019-05-08,"The index's next move could depend on Microsoft, Amazon, Apple, Alphabet, Facebook and Berkshire Hathaway, chart master Carter Worth says."
"Cramer: Markets could roar after we get past Friday's Uber, tariff gauntlet",2019-05-08,"Even if the Uber IPO gets botched and the world's largest economies do not come to a trade truce on Friday, the market will remain in decent shape at the end of the week, Cramer said."
Under Armour CEO says the company is ready to 'reset ourselves' in North America,2019-05-08,"Under Armour CEO Kevin Plank breaks down how the sports apparel manufacturer is positioning itself for sustainable, long-term growth."
Cramer's lightning round: I have no energy for these energy companies,2019-05-08,Jim Cramer takes calls and delivers answers to viewers' favorite stock picks of the day in rapid speed.
Cramer Remix: LendingTree could get a boost from lower interest rates,2019-05-08,Jim Cramer explains how LendingTree has overcome the short sellers and can succeed with lower interest rates.
Cramer's lightning round: Zebra Technologies is a kind of fast grower we like,2019-05-09,"It's that time again! ""Mad Money"" host Jim Cramer rings the lightning round bell, which means he's giving his answers to callers' stock questions at rapid speed."
'Hell week' is almost over for the markets  ECramer reviews the winners,2019-05-09,"""When a sell-off goes into its third day, the buyers just stand there and absorb the market's body blows. And then stocks start rallying like nobody's business,"" Jim Cramer says."
"Cramer: How Trump's 'surreal, fanciful vision' can force China to a trade agreement",2019-05-09,"Trump can attempt to mitigate the damage by floating some good news about trade discussions as he did Thursday, Cramer says."
Etsy CEO shrugs off 'rocky' start to Q1: 'We feel really good',2019-05-10,Etsy CEO Josh Silverman tells Jim Cramer he is optimistic about the rest of the year and explains the e-commerce platform's plan to reduce carbon emissions.
Cramer Remix: Charts suggest the market could soon get a deep correction,2019-05-10,Jim Cramer takes a look at the warning signals one analyst points out in the charts to find out what could lie ahead in this market.
Should you really do nothing amid market volatility? It depends on whether you're 27 or 63,2019-05-10,"As the longest bull market in history wanes, it can be helpful to turn your attention to your own timeline."
"Cramer's week ahead: The market can go higher with Uber's IPO, tariffs behind us",2019-05-10,"""We made it through hell week ... We can finally start talking about earnings and interest rates again,"" Jim Cramer says."
Cramer adds 3 stock picks to his long-term 5G play,2019-05-10,"Investors should fall back on their favorite long-term themes in a confusing market. The 5G buildout is one of the best, Jim Cramer says."
Cramer: These stocks were 'far more ready' for Trump's tariff hikes than investors realized,2019-05-10,"""They've made a lot of the necessary adjustments,"" Jim Cramer says."
Cramer Remix: The Chinese government has a weak hand when it comes to trade,2019-05-10,Jim Cramer explains why the Chinese have more to lose than we do when it comes to the trade debate.
Nestle CEO: We have a lot to show in the vegan burger market,2019-05-13,Nestle CEO Mark Schneider explains the company's plans to roll out plant-based food in Europe and the United States.
Get ready to pull the trigger on these stocks  E'We're almost in oversold territory': Cramer,2019-05-13,"The best picks may be in the managed care, insurance and telecommunication spaces."
Twitter CFO: Trade tensions won't ding our digital advertising business in China,2019-05-13,"""That's been a great business for us,"" Twitter CFO Ned Segal says."
"Cramer Remix: Tariffs could hurt earnings, but for some CEOs, it's worth it",2019-05-14,Jim Cramer reveals how some CEOs are willing to take the tariff pain because they're fed up with China's trade practices.
Cramer's lightning round: We're late to the Qualcomm party  ENot here,2019-05-14,"It's that time again! ""Mad Money"" host Jim Cramer rings the lightning round bell, which means he's giving his answers to callers' stock questions at rapid speed."
Adobe CEO: We're 'optimistic' about our prospects in the wake of tariffs,2019-05-14,"""Our exposure to China in both [creative and enterprise] is fairly minimal,"" CEO Shantanu Narayen says."
"Tuesday saw a 'genuine rally, and that is a bullish sign,' Jim Cramer says",2019-05-14,"The stock market saw a broader rally than expected, and that's good news, the ""Mad Money"" host says."
Cramer Remix: What's behind today's huge sell-off,2019-05-14,Jim Cramer reveals that the coupling of an escalating trade war with China and Uber's IPO fiasco led to the market's dip.
"Cramer's lightning round: Fox is a 'good stock,' but I prefer Disney",2019-05-14,"It's that time again! ""Mad Money"" host Jim Cramer rings the lightning round bell, which means he's giving his answers to callers' stock questions at rapid speed."
Williams-Sonoma CEO: We saw China tariff hikes coming and hired more US workers,2019-05-14,"""I think that you're better off preparing for the worst,"" Laura Alber said in a one-on-one interview with ""Mad Money's"" Jim Cramer Monday."
"People should be able to get health care without going bankrupt, GoodRx co-CEO says",2019-05-15,"Most Americans could go bankrupt if their health insurance won't cover high pharmaceutical prices, co-CEO Doug Hirsch says."
Cramer Remix: Here are the go-to names in an economic slowdown,2019-05-15,"Jim Cramer says the ""Cloud Kings"" are a great secular trend to invest in during times of economic uncertainty."
Cramer: Wednesday's 'crazy session' is a perfect example of the market's new normal,2019-05-16,"""Turns out we can get good news, too, and some days like today the stock market actually makes sense,"" Jim Cramer says."
"Roku CEO: Media companies are partnering with us, not destroying us",2019-05-16,"""We can really help those companies build scale if they want to use some of the marketing techniques we have on our platform,"" CEO Anthony Wood says."
SoFi CEO reveals what he learned about millennial stock investing habits,2019-05-16,"Early investors are showing ""that they don't want to put a lot of money at risk,"" SoFi CEO Anthony Soto says."
Seven comeback stocks that investors could pounce on: Cramer,2019-05-16,Jim Cramer identifies seven stocks that have lagged the broader market and are starting to catch steam.
Cramer's lighting round: I like Carvana  E'I'm a millennial wannabe',2019-05-16,Jim Cramer hears from callers and gives his thoughts on their stock picks of the day.
Cramer Remix: Investors should take cannabis hype with a grain of salt,2019-05-16,"Jim Cramer explains that, while he's a believer in the cannabis business, conviction should be tempered with discipline."
"Cramer's lightning round: Arena Pharmaceuticals, Yext, IAC, and more",2019-05-17,Jim Cramer takes calls and delivers answers to caller stock picks in the latest lightning round.
Pinterest CEO after earnings report tumble: We're in the growth phase of our business,2019-05-17,"""We're trying to be transparent and ... we want to focus on the long term,"" CEO Ben Silbermann says."
Cramer: Trump no longer cares if his China policies hurt American businesses,2019-05-17,"The executive action against Chinese telecommunications giant Huawei ""was a major escalation from the White House,"" Jim Cramer says."
Two charts suggest the stock market may repeat the 'sins' of 2018,2019-05-17,"Markets have seen a reprieve from selling in recent days, but NorthmanTrader founder Sven Henrich says the underlying technicals tell a different story."
Cramer's week ahead: A slate of retail earnings reports could shed light on the China trade impact,2019-05-17,"""This is the week when most retailers report, so we will be listening closely to what they say about the trade war,"" Jim Cramer says."
Cramer Remix: InterActiveCorp is inexpensive here and is a buy right here,2019-05-18,Jim Cramer says he doesn't understand why IAC is trading at current levels after reporting an amazing quarter.
"Nvidia CEO doesn't expect China to block $7 billion takeover of Mellanox, despite trade tensions",2019-05-19,Nvidia CEO Jensen Huang tells Jim Cramer why the chipmaker won't be impacted by tariffs on Chinese imports.
Jim Cramer: 'Your portfolio should have as little exposure to China as possible',2019-05-20,"""As long as President [Donald] Trump believes that the Chinese are the ones who pay the price, he's going to keep taking a hard-line approach to these negotiations,"" Cramer said."
Jim Cramer reveals his top social media stocks,2019-05-20,"Jim Cramer ranks the stocks of Twitter, Snap, Pinterest and Facebook."
Cramer Remix: Be very careful with Luckin Coffee's IPO,2019-05-20,"Jim Cramer examines Luckin Coffee, the latest Chinese company to hit the tape."
Cramer: Health care stocks are rising on hopes Biden will snag the 2020 Democratic nomination,2019-05-21,"""Unlike Bernie Sanders or Elizabeth Warren or Kamala Harris, Biden's against 'Medicare for All,'"" the ""Mad Money"" host says."
Cramer's lightning round: I feel bad if you own Intrexon  EIt's a loser,2019-05-21,Jim Cramer takes calls and delivers thoughts about viewers' stock picks of the day.
Jim Cramer: Any US-China trade deal will send the market into an 'epic rebound',2019-05-21,"As of Tuesday, an imminent deal seems unlikely, with both countries refusing to compromise, Cramer said."
Cramer: Stay away from this 'forbidden city of stocks',2019-05-21,Jim Cramer says there's a shortage of buyable stocks on the market and that money managers are staying out of these sectors.
Cramer's lightning round: McDonald's is 'one of the greatest stocks of our time',2019-05-21,"Jim Cramer takes calls and gives his thoughts on McDonald's, Nektar Technologies, L Brands, and more."
"Cramer Remix: Owning Apple may get rocky, so hold on tight",2019-05-22,"Jim Cramer reiterates that investors should own Apple, not trade it, but cautions that the stock could be hurt by trade tensions."
"Cramer: Retailers, chipmakers and autos are feeling the pain of China exposure",2019-05-22,"""I just want you to know what you own so you're not surprised when this pattern continues,"" Jim Cramer says."
Cramer: Target's Q1 shows it has a recipe to beat Amazon and win in retail,2019-05-22,"""Target's gutsy decision to make its stores the centerpiece of its fulfillment system has turned out to be a brilliant move,"" Jim Cramer says."
Idexx Labs is counting on millennials to boost the pet-care industry,2019-05-22,"""[Millennials] are more likely to go to the vet more frequently and more willing to listen to an advanced standard of care,"" Jonathan Ayers says."
Cramer Remix: The cannabis stocks I'm eyeing,2019-05-22,Jim Cramer turns to the charts to reveal that cannabis companies like GW Pharmaceuticals and Village Farms could be good additions to your portfolio.
The 5G rollout has cell tower stocks in 'raging bull market mode': Cramer,2019-05-23,"""Once you build a tower, you can just add another antenna to it when you pick up a new client, so the margins are terrific,"" he says."
Novartis CEO calls for fixing 'distortions' in health-care system ahead of slate of drug launches,2019-05-23,"""I can't remember a time at Novartis where year after year after year we have these significant medicines getting launched,"" CEO Vasant Narasimhan says."
Cramer: Investors are holding out hope for a trade deal  Ethat's why the market hasn't bottomed yet,2019-05-23,"Sentiment is ""not negative enough to trigger a huge rally ... unless we get some kind of real breakthrough with China,"" Jim Cramer says."
"Cramer: The bad trade news is partially baked in, but the sell-off isn't over",2019-05-23,"""We still haven't seen the big estimate cuts that we can expect from the analysts who weren't expecting President Trump to keep raising tariffs,"" Jim Cramer says."
Cramer Remix: Why Chipotle's downgrade is misguided,2019-05-23,Jim Cramer explains why worries at the restaurant chain may be off-base.
"Mondelez isn't feeling the heat from global consumer worries, CEO says",2019-05-28,Mondelez International CEO Dirk Van de Put explains how changing consumer habits are boosting the Oreo-maker's sales.
Cramer: The US economy 'could be on the verge of a significant slowdown',2019-05-28,"With consumer and corporate confidence waning, the economy could slowdown ""if something doesn't change soon,"" Jim Cramer says."
"Cramer: Betting on the Fed to cut interest rates is 'very risky,' charts show",2019-05-28,Jim Cramer takes a look at chart analysis by DeCarley Trading's Carley Garner to determine if there is a buying opportunity in the future.
Cramer Remix: Competition can't take on this payment juggernaut,2019-05-28,Jim Cramer breaks down how consolidation in the fintech space still can't overcome PayPal's dominance.
"Jim Cramer: It's time to start buying amid market weakness, but take it slow",2019-05-29,"""Now that people are really freaking out ... I think it's time to start picking up stocks into weakness,"" Jim Cramer says."
Cramer's lightning round: We sold Anadarko. It's time to move on,2019-05-29,Jim Cramer talks with viewers and gives his thoughts about their stock picks of the day.
Cramer Remix: I think this is a great spec play that could get acquired,2019-05-29,Jim Cramer explains that bluebird bio's technology offerings make it attractive for a potential takeover.
"Agco CEO: We're focused on improving our margins, not on China",2019-05-29,"Agco, an agricultural equipment manufacturer based in Georgia, upped its full-year earnings guidance by almost 30 cents."
Not sure if a stock is worth buying at current levels? Follow Jim Cramer's checklist,2019-05-30,"""Money managers are desperate to avoid owning companies that could be facing estimate cuts, and this checklist is what protects them,"" Jim Cramer says."
Canopy expects to see the next cannabis breakthrough in 24 months,2019-05-30,"""That's just enough time to use all of our IP and brands to really get ahead,"" Canopy Growth CEO Bruce Linton says about its acquisition of Acreage."
Pioneer CEO says the natural gas company avoided a downturn in prices by shipping out to California,2019-05-30,"""Pioneer has taken our gas to California, so we're not seeing any of the negative prices,"" Pioneer Natural Resources CEO Scott Sheffield says."
Cramer Remix: Spotting stocks that will rise from the retail wreckage,2019-05-30,Jim Cramer explains how to find retail stories that work in a difficult environment.
Cramer Remix: Presume Trump will go through with tariffs on Mexico,2019-05-31,Jim Cramer warns CEOs to prepare their companies for a hit after President Trump's latest call for tariffs.
Cramer's lightning round: Aramark is in the 'penalty box',2019-05-31,Jim Cramer takes calls and delivers answers on callers' questions about their stock picks of the day.
"Okta CEO says cloud company has a 'close eye' on tariffs, but for now exposure is minimal",2019-05-31,"""We do think about powering business globally, so it's in everyone's interest I think to have as much free trade  Eas much economic commerce  Eas possible,"" Todd McKinnon says."
Cramer's week ahead: Only game-changing data can counter Trump's surprise tariffs on Mexico,2019-05-31,"""In an era where all that matters is who's next for punishment, we need to be very cautious,"" Jim Cramer says."
"IBM CEO: AI-driven jobs are coming, and businesses need to prepare a new generation of workers",2019-05-31,"""We build these technologies so I think we have a responsibility … to prepare society for these technologies,"" CEO Ginni Rometty says."
Wingstop CEO says digital technology gives the chicken wing chain an edge over competitors,2019-06-03,"A digital transaction tends to have almost a $5 higher average ticket, which means better return on investment, CEO Charles Morrison says."
Cramer's lightning round: 'Wendy's is one of my absolute favorites',2019-06-03,Jim Cramer takes calls and delivers his thoughts on callers' stock picks of the day.
Cramer Remix: Put VF Corp on your shopping list,2019-06-03,Jim Cramer breaks down VF Corp's performance over the last year and reveals the stock will be a more compelling buy towards the end of the summer.
"Cramer: Trump's going after business, and that's bad for stocks",2019-06-03,"""The president's whims have trumped his pro-business attitude ... [and] investors are going to pay less"" for stocks, Jim Cramer says."
"Brinks CEO: $160 billion cannabis industry, much of it still illegal, is a 'beautiful opportunity'",2019-06-03,"Cannabis is going to be a booming global industry ... ""there's a huge opportunity and demand out there,"" Brinks CEO Douglas Pertz says."
Tesla just finished its best day of the year,2019-06-04,"Tesla is still the worst performer of 2019 on the Nasdaq 100 Index, down 42% for the year."
"'Don't get overconfident' after Tuesday's big rally, Jim Cramer says",2019-06-04,"""Remember, good things can still happen, but don't get overconfident, because bad things can happen, too,"" Jim Cramer says."
Cramer's lightning round: I should've gotten behind this stock when it was lower,2019-06-04,Jim Cramer takes calls and delivers his responses in rapid speed to viewers' stock picks of the day.
Cramer Remix: Why big tech stocks are out of luck here,2019-06-04,Jim Cramer explains why woes could worsen for four tech titans.
Chipotle CFO shrugs off potential $15 million hit from Mexican tariffs  EThis 'won't impact us',2019-06-04,"""[The tariffs] is an impact of about $15 million this year, a little bit more next year,"" CFO Jack Hartung says."
