Headlines,Time,Description
Cramer: Never buy a stock all at once  Eyou'll almost definitely get burned,2017-12-22,Jim Cramer doubled down on his key investing rule of never buying a desired stock all in one go.
Cramer: I helped investors through the 2010 flash crash by following one key rule,2017-12-22,"Jim Cramer built on his ""nobody ever made a dime panicking"" mantra by explaining how investors can apply it to their portfolios."
Cramer says owning too many stocks and too little cash can set you up for failure,2017-12-22,"Jim Cramer broke down why owning fewer stocks can help make you more money, and why investors shouldn't be ashamed of having cash on hand."
Markets lack Christmas cheer,2017-12-26,"According to Kensho, here's how markets have fared during the week of Christmas over the past five years."
S&P tends to start new year bullish after this happens,2017-12-27,"The S&P is on track to end the year up 20 percent. After previous double-digit gains of 10 percent or more, the bullish trend tends to carry through to the following quarter.  "
Cramer Remix: Apple's stock won't slow down in 2018,2018-01-02,Jim Cramer dished out his take on whether Apple can continue to stay juicy this year after it had a big run last year.
Cramer shares his top energy stock picks as oil prices rise,2018-01-02,Jim Cramer revisited the oil sector and hand-picked the best investment guidelines for the energy stock comeback.
Cramer's lightning round: Buy Becton Dickinson's stock hand over fist,2018-01-02,"Jim Cramer rattled off his take on callers' favorite stocks, including one of his favorite biotechnology plays."
Cramer Remix: My prediction for Apple in 2018,2018-01-02,Jim Cramer dished out his take on whether Apple can continue to stay juicy this year after it had a big run last year.
Cramer reflects on how Trump's actions are fueling the 'beast' market rally,2018-01-02,"Jim Cramer examined the notion that investors are ""bored"" with the market rally and explained how the president is driving stocks higher."
The major indexes trade lower in January,2018-01-02,"Our data partners at Kensho say beware of January. Since 2012 on average the Nasdaq, S&P 500, Dow and Russell all trade lower in the first month of the year. "
Cramer's S&P 500 and Dow charts indicate a strong start to 2018,2018-01-02,Jim Cramer warned investors about getting too cynical after a robust year for the averages and healthy momentum ahead.
Markets after S&P gains 15% in a year,2018-01-03,"According to our data partners at Kensho, after the S&P finished 15% up or more in a year the index is positive 77% of the time the following year, returning an average of 8.8% since 1980. The Nasdaq and Dow also have good track records after a big year. "
Cramer: Analyst recommendations are already boosting stocks in 2018—and they won't stop,2018-01-03,"Jim Cramer highlighted the flurry of bullish, stock-moving analyst notes issued after the Republican tax bill became law."
Cramer reviews the Dow's biggest winners and losers for 2017,2018-01-03,Jim Cramer reviewed the Dow Jones industrial average's best and worst performers for the 2017 calendar year.
Cramer dubs Children's Place a 'fabulous' buy on weakness,2018-01-03,"Jim Cramer tracked Children's Place's positive drivers and anointed it one of his few ""buys"" in brick-and-mortar retail."
Cramer's lightning round: Don't sell the stock of Ametek. It's a winner,2018-01-03,"Jim Cramer flew through his take on callers' favorite stocks, including an under-the-radar industrial play."
"Cramer Remix: I've issued more mea culpas on GE than any other stock, but I'm not giving up just yet",2018-01-03,Jim Cramer revealed why he hasn’t given up on GE yet.
Cramer: The US-China 'trade war' could explode in 2018,2018-01-04,Jim Cramer made the case for President Donald Trump and the U.S. Department of Commerce to prohibit Chinese steel dumping.
"Cramer Remix: Even at Dow 25K, this market is a beast, and it's a beauty",2018-01-04,Jim Cramer dished on what’s behind the strength of this market.
"Cramer's lightning round: Stop talking, start buying Raytheon",2018-01-04,"Jim Cramer zoomed through his take on callers' favorite stocks, including a defense play fresh off some momentary weakness."
"Cramer Remix: Even at Dow 25K, this market is a beast, and it's a beauty",2018-01-04,Jim Cramer dished on what’s behind the strength of this market.
Cramer pinpoints stocks that are feeding the market in 'beast mode',2018-01-04,"Jim Cramer zoomed in on the stocks that drove the ""beast"" market to new highs on Thursday, including Dow 25,000."
"Tax cuts may be good for short-term profit pop, but long term outlook not so rosy",2018-01-04,Concern that tax reform offers only a one-time lift to stocks and it may all be discounted before this month is over.
Dominion CEO bullish on latest deal: 'We're investing for the long term in South Carolina',2018-01-04,Jim Cramer spoke to Dominion Energy CEO Tom Farrell about his company's acquisition of struggling South Carolinian utility Scana.
Last year's S&P 500 winners could still have room to run,2018-01-05,Jim Cramer ran through the S&P 500's worst performers for 2017 and found some redeemable players in the house of pain.
Last year's S&P 500 losers could be prime for speculation,2018-01-05,Jim Cramer ran through the S&P 500's worst performers for 2017 and found some redeemable players in the house of pain.
Cramer Remix: Common sense can make you money in this market,2018-01-05,"Jim Cramer explained how observations, and not just knowledge of stocks, could help you find your next play."
Cramer says the S&P 500's biggest 2017 losers could be prime for speculation,2018-01-05,Jim Cramer ran through the S&P 500's worst performers for 2017 and found some redeemable players in the house of pain.
Cramer's lightning round: Buy B&G Foods on its millennial advantage,2018-01-05,"Jim Cramer zipped through his take on callers' favorite stocks, including a food product play."
Cramer Remix: Common sense can make you money in this market,2018-01-05,"Jim Cramer explained how observations, and not just knowledge of stocks, could help you find your next play."
Cramer: The S&P 500's winners for 2017 could still have room to run this year,2018-01-05,Jim Cramer reviewed the S&P 500's best performers for 2017 and noted the names that have more room to run.
Cramer's game plan: Feeding the beast with a bank earnings kicker,2018-01-05,"Jim Cramer looked ahead to the stocks and events he'll watch next week, including two major conferences and earnings from the banks."
Cramer: The S&P 500's winners for 2017 could still have room to run this year,2018-01-05,Jim Cramer reviewed the S&P 500's best performers for 2017 and noted the names that have more room to run.
Under Armour cools off after gains,2018-01-05,"Our data partners at Kensho, show after a move of 10% or more in a week Under Armour cools off. Down three percent on average a week later."
Stocks tend to be cold in January,2018-01-05,"January tends to be a tough month for stocks  with the Dow, S&P, Dow and Russel 2K all averaging losses of more than one percent. "
Cramer says the S&P 500's biggest 2017 losers could be prime for speculation,2018-01-05,Jim Cramer ran through the S&P 500's worst performers for 2017 and found some redeemable players in the house of pain.
Markets after Q1 first-week streak,2018-01-08,"Our data partners at Kensho say the rally is due to roll at least until the end of the quarter. Since 1980 when up the first week of the year, the run continues. The Nasdaq up an average of 6.96% in Q1. Almost 4% for the S&P and Dow after a good first week. "
Cramer says 4 things—including the tax overhaul—will continue to push stocks higher,2018-01-08,"Jim Cramer explained how index funds, stock shortages, tax cuts and low valuations all coalesce to drive stocks higher."
"Cramer: Marijuana, bitcoin and Micron are all speculative investments",2018-01-08,"Jim Cramer gauged the speculative potential of the cannabis, cryptocurrency and chipmaking markets for individual investors."
"'Best days are still ahead' for top opioid addiction treatment Vivitrol, CEO says",2018-01-08,"Jim Cramer spoke to Alkermes CEO Richard Pops, who said 2018 will be a year of milestones for his company's drugs."
Cramer's lightning round: Mercadolibre is even better than eBay was,2018-01-08,"Jim Cramer rattled off his take on callers' favorite stocks, including a Latin American e-commerce play."
Cramer Remix: Tesla’s stock is up for one simple reason,2018-01-08,Jim Cramer lifted the hood on Tesla’s move higher and why he thinks the stock rose despite fewer-than-expected Model 3 deliveries in Q4.
Cramer Remix: My warning to the market cynics,2018-01-09,Jim Cramer broke down the action in the market and explained why he thinks investors can’t afford to be too cynical.
"Three rate hikes by the Fed in 2018 would be problematic for markets, expert says",2018-01-09,"The latest FOMC projections indicate three rate hikes for 2018, but markets have only priced in two increases."
Cramer's lightning round: The analysts downgrading Edwards Lifesciences are 'knuckleheads',2018-01-09,"Jim Cramer flew through his take on callers' favorite stocks, including a biotechnology stock being targeted by Wall Street."
Children's Place CEO: We have the 'dream customer'—millennial moms,2018-01-09,"Jim Cramer sat down with Children's Place President and CEO Jane Elfers, who broke down the company's turnaround strategy."
Cramer lists 6 tailwinds for consumer-related stocks,2018-01-09,Jim Cramer made the bull case for consumer stocks in a defining era for traditional retailers.
"Physical stores are 'critical' no matter where consumers choose to shop, Kohl's CEO says",2018-01-10,"Jim Cramer sat down with Kohl’s CEO Kevin Mansell, who discussed his company's partnership with Amazon and his outlook on retail."
Cramer makes the bull case for China's move to cut US debt purchases,2018-01-10,Jim Cramer laid out the benefits of China potentially halting its purchases of U.S. sovereign debt.
'There's a rhythm to these things:' Domino's Pizza CEO discusses impending departure,2018-01-10,Jim Cramer spoke with Domino's Pizza CEO Patrick Doyle to discuss his recently announced departure from the company.
Cramer's charts show video game stocks like Take-Two have more room to run,2018-01-10,Jim Cramer took to the charts of video game stocks with technician Rob Moreno to see if the red-hot sector still has gains left.
Cramer's lightning round: Wait for General Dynamics—it's about to move higher,2018-01-10,"Jim Cramer shared his take on callers' favorite stocks, including a play on aerospace and defense."
Cramer Remix: Domino’s Pizza proves why stock-picking is still a winning strategy,2018-01-10,Jim Cramer dished on how Domino’s Pizza was able to outperform index funds despite the increasingly difficult environment.
Cramer Remix: Boeing is a better bet than bitcoin,2018-01-11,Jim Cramer revealed what he’s recommending over the cryptocurrency.
"Cramer's lightning round: People might be bailing on Regeneron, but it's a buy",2018-01-11,"Jim Cramer zoomed through his take on callers' favorite stocks, including a pharmaceutical name spooking investors."
"Cramer shares 5 reasons why the retail sector is back in action, according to industry executives",2018-01-11,Jim Cramer relayed five factors driving the retail cohort back into Wall Street's good graces.
Cramer explains the nonsensical action in oil and airline stocks,2018-01-11,"Jim Cramer pointed out the contradictory action in oil prices and airline stocks, two related sectors benefiting from the bull market."
Cramer prepares investors for the big banks' Friday earnings reports,2018-01-11,"Jim Cramer told investors what to pay attention to in J.P. Morgan, Wells Fargo and PNC's earnings reports."
Markets after the start of Q4 earnings season,2018-01-12,"According to Kensho, this is the place to be after the start of earnings season. "
Cramer's game plan: JP Morgan set the benchmark. Now watch the banks,2018-01-12,Jim Cramer laid out the stocks and events he'll be watching as earnings season kicks into high gear with the big banks' reports.
Cramer: 'This time it's different' can actually make you money,2018-01-12,"Jim Cramer said the success of Facebook, Amazon, Netflix and Alphabet proves why ""this time it's different"" can help you, not hurt you."
Cramer gets bullish on casino stocks like Wynn Resorts as Macau prospects improve,2018-01-12,Jim Cramer tracked the casino stocks' months-long rebound to gauge whether an improving outlook overseas could still drive their gains.
Cramer's lightning round: Estee Lauder's CEO makes this stock a beauty,2018-01-12,"Jim Cramer zipped through his take on callers' favorite stocks, including that of a cosmetics company with a top CEO."
Cramer Remix: Tuesday's the day to buy Facebook,2018-01-12,Jim Cramer offered his take on Facebook’s action in this market.
Cramer's lightning round: GoPro won't be bought for more than $1B,2018-01-16,"Jim Cramer rattled off his take on callers' favorite stocks, including a device play fielding rumors of a buyout."
Cramer Remix: The prospect of stock buybacks should calm fears of a major market decline,2018-01-16,Jim Cramer said there’s one thing that this market needs to do to curb the major stock shortage facing investors.
"Cramer's charts suggest Amazon, Alphabet, Netflix and Nvidia's stocks might be about to pull back",2018-01-16,Jim Cramer examined the tech titans' weekly stock charts to determine if it's time for investors to take some profits.
Cramer's 5 cardinal rules of engagement with the bull market,2018-01-16,Jim Cramer gave investors several key guidelines for maneuvering the bull market in beast mode.
Cramer reveals the biggest winners and losers from the JP Morgan Healthcare Conference,2018-01-16,Jim Cramer listed the J.P. Morgan's Healthcare Conference's best and worst performers judging by the stock market's reaction.
Weeden:  What's different in this market today than a few weeks or months ago?,2018-01-17,"Michael Purves of Weeden says if rates and inflation accelerate, the markets could explode in the first half of the year, but decline in the second half."
Cramer calls Apple's $350 billion investment in the US economy a 'modern-day Marshall Plan',2018-01-17,Jim Cramer interviewed Apple CEO Tim Cook after his company's pledge to contribute $350 billion to the U.S. economy.
Cramer remains confident on most major banks after earnings,2018-01-17,"Jim Cramer reiterated his bullishness on J.P. Morgan, Citigroup and Bank of America after a flurry of earnings reports from the big banks."
Top energy executive says natural gas industry will need $150 billion of infrastructure investment,2018-01-17,"Jim Cramer sat down with natural gas guru Charif Souki, who shared his outlook on the future of natural gas exploration."
Cramer's lightning round: I prefer Disney to Twenty-First Century Fox,2018-01-17,"Jim Cramer flew through his take on callers' favorite stocks, including an entertainment play making headlines."
"IBM executive says blockchain 'creates a lot of value' for manufacturers, retailers",2018-01-18,"Jim Cramer spoke with IBM's Martin Schroeter after earnings to hear his take on blockchain, bitcoin and the new tax law."
"Cramer tracks 4 growing market discrepancies: Rates, Trump, cryptocurrencies and stocks",2018-01-18,Jim Cramer tapped into four conflicting arguments in the stock market that are dominating the tape.
Cramer Remix: How I decide which retailers are not buyable,2018-01-18,Jim Cramer explained how he uses his shopping experiences to help determine which retailer stocks are not worth buying.
"WWE is a 'data powerhouse' thanks to content, growth and digital, CFO says",2018-01-19,Jim Cramer sat down with WWE CFO George Barrios to understand how the company continues to captivate its massive audience.
Cramer Remix: The real  Eild card Ebehind soaring retail revenues,2018-01-19,Jim Cramer detailed how ramped-up consumer spending is bolstering the retail sector beyond what tax reform can do.
Cramer: I've never seen a market like this in my life,2018-01-19,Jim Cramer said an overload of buyers in the stock market is resulting in dramatically rising stock prices.
Cramer's lightning round: Hormel's one of the few food stocks I like,2018-01-19,"Jim Cramer zoomed through his take on callers' favorite stocks, including one food stock with good growth prospects."
Cramer: The Amazon Prime rate bump is a clarion call to buy the stock,2018-01-19,"Jim Cramer explained why buying shares of Amazon, Netflix and Costco when they raise their subscription prices is a winning strategy."
Cramer's lightning round: Buy Cisco before its quarterly earnings report,2018-01-19,"Jim Cramer shared his take on callers' favorite stocks, including a high-profile tech name about to report earnings."
Cramer's game plan: Watch these stocks as earnings season kicks into high gear,2018-01-20,Jim Cramer advised investors on stocks to watch as earnings season begins in earnest and companies guide toward tax reform benefits.
Cramer's lightning round: Stick with Splunk for an investment in the cloud,2018-01-22,"Jim Cramer zipped through his take on callers' favorite stocks, including an under-the-radar cloud giant."
Cramer Remix: ADT's IPO was the latest insult to this market,2018-01-22,Jim Cramer broke down why he thinks the IPO market has been slim pickings amidst the current bull market.
'Shark Tank's' Daymond John: Being selfish is a key to success,2018-01-22,"Jim Cramer sat down with ""Shark Tank"" investor and FUBU chief Daymond John to hear about his latest book and favorite market trends."
Cramer Remix: My advice for Lloyd Blankfein on cryptocurrencies,2018-01-22,Jim Cramer revealed why cryptocurrency could be key for Goldman Sachs.
Cramer: Blink and you'll miss this market's windows of opportunity,2018-01-22,Jim Cramer stressed the importance of buying stocks on weakness and pinpointed the small moments investors get to buy in.
Cramer's guide to investing in the stock market's winning sectors,2018-01-22,"Jim Cramer did a deep dive into the market's strongest sectors, including tech and the banks, to find the best investments in each space."
The regular investor can now trade the stock market 24 hours a day,2018-01-22,Traders on the TD Ameritrade platform are now able to buy and sell shares of ETFs like the SPDR S&P 500 (SPY) at any time of the day.
Market performance after the government reopens,2018-01-23,"Since 1980 the government has shut down 12 times. Two weeks after it reopens for business stocks tend to perform well, with the Dow and S&P each gaining 3%"
'Rocket fuel' from tax cuts will continue to drive US markets,2018-01-23,"Robert Lutts of Cabot Wealth Management says stocks can still move higher with the S&P 500 reaching 3,150."
Cramer: Check your bias at the door with stocks like Facebook and P&G,2018-01-23,Jim Cramer argued against selling high-quality stocks because of negative news and told investors to break the weak-handed habit.
"Cramer: With speculators the most bullish in history, charts show oil prices could soon peak",2018-01-23,Jim Cramer drilled down on the oil patch with help from technician Carley Garner to check the strength of crude prices.
Cramer's lightning round: Buy HP Inc. despite Morgan Stanley's downgrade,2018-01-23,"Jim Cramer shared his take on callers' favorite stocks, including a recently downgraded technology play."
Cramer Remix: Netflix's recent run makes me upset,2018-01-23,"Jim Cramer was happy about the Netflix quarter, but bummed that it could have been acquired a very long time ago."
"Top consumer tech CEO shares top 3 growth drivers: Location, innovation and diversification",2018-01-24,"Jim Cramer sat down with Logitech CEO Bracken Darrell to speak about the consumer, e-commerce and the tech company's latest products."
"Barstool Sports CEO Erika Nardini: There is nothing this cult-like, male-focused media brand can’t do",2018-01-24,"Jim Cramer sat down with Barstool Sports' founder, Dave Portnoy, and CEO, Erika Nardini, to discuss the controversial brand's rise to power."
Cramer unpacks the wild action in a 'new' kind of market—one with 3 trading sessions a day,2018-01-24,"Jim Cramer adopted a new view of the stock market, which had a monster rally and a treacherous dive all in one trading day."
"Cramer: Contrary to popular belief, now is a good time to buy consumer goods stocks",2018-01-24,Jim Cramer made the bull case for buying consumer packaged goods stocks Procter & Gamble and Kimberly-Clark in this environment.
Cramer's lightning round: US Concrete could go higher because of state spending,2018-01-24,"Jim Cramer rattled off his take on callers' favorite stocks, including an infrastructure play."
"Head of esports scholarship program is bullish on competitive gaming, but not with games like NBA 2K",2018-01-26,Jim Cramer sits down with UC Irvine's Acting Director of esports Mark Deppe to hear about how competitive gaming is coming to colleges.
Cramer says the market's other FANG is a great growth play on oil,2018-01-26,Jim Cramer taps Diamondback Energy as one of the best ways to play crude oil's price recovery.
Cramer's lightning round: I would not sell Valeant right now,2018-01-26,"Jim Cramer flew through his take on callers' favorite stocks, including a pharmaceutical play undergoing a turnaround."
Cramer Remix: My loneliest defense of Apple yet,2018-01-26,Jim Cramer revealed why he still believes in Apple’s ability to head higher.
Cramer weighs in on the stock of Wynn Resorts after misconduct allegations,2018-01-29,"Jim Cramer estimates the future of Wynn Resorts after its CEO, Steve Wynn, was accused of sexual misconduct."
"Cramer's lightning round: Prudential's not Metlife, but watch out for pin action",2018-01-29,"Jim Cramer zoomed through his take on callers' favorite stocks, including an insurance play."
Cramer Remix: Why Apple’s stock has been set up to fail,2018-01-29,"Jim Cramer still says to hold Apple, not trade it, but shares why he feels indifferent to its upcoming quarter."
Daryl Guppy takes a look at the S&P 500,2018-01-29,"Daryl Guppy of Guppytraders.com sees strong support around 2,700 for the S&P 500 and advises to wait on Apple."
Cramer Remix: The 115-year-old 3M is still getting it right,2018-01-29,Jim Cramer reveals why 3M is an oldie but a goodie.
Cramer: Use the earnings 'damage' to your advantage this week,2018-01-29,Jim Cramer advises investors on how to use their cash wisely during a volatile week of earnings.
Goldman Sachs sees 'high probability' of a stock market correction in the coming months,2018-01-29,"Goldman Sachs believes ""correction signals are flashing"" and is advising its clients to prepare for a correction."
Cramer's game plan: Welcome to the Super Bowl of earnings,2018-01-29,"Jim Cramer looks ahead to a major earnings week with the likes of Boeing, Facebook and Apple set to report."
Cramer's charts forecast further gains for health care giants Centene and Cardinal Health,2018-01-29,"Jim Cramer takes to the charts with Marc Chaikin to see if shares of Centene, Cardinal Health and Amgen have more room to run."
Cramer says Centene is the way to play the Amazon-Berkshire-JP Morgan health care move,2018-01-30,"Jim Cramer advises investors on how to act after Amazon, Berkshire Hathaway and J.P. Morgan announced a joint foray into health care."
Top steel CEO says US 'desperately' needs new infrastructure to sustain economic boom,2018-01-30,Jim Cramer speaks to Nucor Chairman and CEO John Ferriola about Chinese steel dumping and President Donald Trump's agenda.
Cramer bullish on Dr Pepper-Keurig deal despite Wall Street's tepid response,2018-01-30,"Jim Cramer lists the benefits of the Dr Pepper Snapple-Keurig Green Mountain deal, zeroing in on Keurig CEO Bob Gamgort's track record."
Cramer's lightning round: AT&T's cash flow could get a boost,2018-01-30,"Jim Cramer zipped through his take on callers' favorite stocks, including a telecommunications play in merger talks."
"Cramer Remix: Amazon knocked Walgreens and UnitedHealth down, but they’ll get back up again",2018-01-30,Jim Cramer predicts how stocks like Walgreens and United Health will fare in light of the Amazon health-care development.
Cramer Remix: AbbVie and Biogen are the best-in-show biotechs for 2018 so far,2018-01-31,Jim Cramer breaks down his take on the biotech pullback and which two he thinks could be top performers.
Cramer's rigorous guide for investing during market volatility,2018-01-31,Jim Cramer lists the secular growth themes worth buying on days when the market takes dramatic swings.
Cramer suggests 6 State of the Union stock picks,2018-01-31,Jim Cramer analyzes the president's State of the Union address to find the best stocks to buy off the rhetoric.
Cramer's lightning round: Take a long-term view on Johnson & Johnson,2018-01-31,"Jim Cramer shares his take on callers' favorite stocks at lightning speed, including one pharmaceutical play under pressure."
Cramer's lightning round: S&P Global's stock is 'nothin' but net',2018-02-01,"Jim Cramer rattles off his take on callers' favorite stocks, including a financial technology name."
Cramer Remix: How you should approach Alphabet’s earnings,2018-02-01,Jim Cramer reveals why he still believes in Alphabet.
"With gasoline exports on the rise, refinery CEO sees global demand increasing in 2018",2018-02-01,Jim Cramer sits down with Marathon Petroleum Chairman and CEO Gary Heminger to discuss global energy trends and President Donald Trump.
"Cramer tackles Facebook, Apple, Amazon and Alphabet earnings as tech giants report",2018-02-01,"Jim Cramer analyzes earnings reports from Facebook, Apple, Amazon and Alphabet."
