Headlines,Time,Description
Cramer: Michael Cohen plea and Paul Manafort verdict could have mixed effects on the market,2018-08-22,Jim Cramer discusses how recent political turmoil involving Michael Cohen and Paul Manafort could propel the markets in either direction.
Cramer's lightning round: Pick this stock for a biotech play,2018-08-22,"Cramer flies through callers' favorite stocks, including which stock to pick to get into biotech."
"Ex-Theranos CEO Elizabeth Holmes believed she was helping the world, Bad Blood author says",2018-08-22,Jim Cramer sits down with Bad Blood author John Carreyrou to discuss Theranos and its former CEO Elizabeth Holmes.
"Global corrections to spread to US and ruin historic bull market, investor Peter Boockvar warns",2018-08-22,"As Wall Street embraces the longest U.S. bull market in history, Bleakley Advisory Group's Peter Boockvar is focusing on what could disrupt it."
"The bull market is ‘fake news Ebut America will still outperform every time, strategist says",2018-08-22,"Investors shouldn't get carried away by the bull market's record, some strategists warn, as soaring equities are currently unique to the U.S. amid weak returns everywhere else. "
Cramer: Charts show pumpkin spice lattes could help Starbucks rebound,2018-08-22,Jim Cramer and technician Tim Collins take a look at the charts to check on Starbucks and see if the coffee chain is headed for a run.  
Cramer Remix: Investors should stop worrying about Trump headlines and focus on spending,2018-08-22,"Jim Cramer explains how consumer spending is what drives our economy, not political turmoil."
Cramer: Cisco's latest quarter proves shift to software is working,2018-08-22,Jim Cramer says that Cisco's fourth quarter is finally bearing the fruit from CEO Chuck Robbins' plan for the company.
Cramer: The longest-ever bull market overcame these 10 obstacles,2018-08-22,Jim Cramer named the top 10 obstacles the market had to overcome in order to achieve this record rally.
Cramer's lightning round: Buy this stock as a defensive play,2018-08-22,"Cramer flies through callers' favorite stocks, including which company could be a good defensive play."
Obscure market statistic could point to record highs for S&P 500 by year-end,2018-08-23,"While the dog days of summer have failed to produce record highs for the S&P 500, one widely followed strategist has a simple message for investors: wait until winter. "
Cramer Remix: Pessimism is weighing on this stock,2018-08-23,Jim Cramer reveals the reason behind Micron’s recent declines. 
Cramer's lightning round: Watch this company's earnings report next week,2018-08-23,"Jim Cramer speeds through callers' favorite stocks, including which tech stock he predicts will report good quarterly earnings numbers next week."
Cramer: The market missed the mark on these stocks during earnings season,2018-08-23,"Jim Cramer gave a rundown of several stocks where the market missed the mark during earnings season, including Home Depot and Lowe's."
Cramer: Williams-Sonoma shows how retail can win,2018-08-23,Jim Cramer takes a deep dive into Williams-Sonoma to show why short-sellers are wrong about the retailer.
"Chinese tariffs are 'no big deal' for natural gas, Tellurian founder says",2018-08-23,Jim Cramer sits down with Tellurian's founder Charif Souki to discuss the trade conflict's potential impacts on liquefied natural gas.
Cramer’s game plan: The end of earnings season can still deliver upside surprises,2018-08-24,Jim Cramer details his game plan for the week ahead as earnings season comes to a close.
"It will take Intel years to fix its chipmaking process and AMD will benefit, analyst says",2018-08-24,"As Intel struggles to fix its chipmaking process, semiconductor company Advanced Micro Devices will continue gaining market share, Wall Street analyst Hans Mosesmann told CNBC on Friday."
Stocks hit all-time highs  Ethese experts break down what investors should do next,2018-08-24,"As stocks hit all-time highs, some fear that bull market will take a sharp turn and that history might repeat itself."
ThirdLove CEO explains how the start-up is thriving as Victoria's Secret struggles,2018-08-24,Jim Cramer sits down with ThirdLove CEO to hear more about how the start-up uses data to make key business decisions.
See which stocks are underappreciated during these market highs,2018-08-28,CNBC's Dom Chu reports on the stocks within the S&P 500 that are underappreciated.
Cramer apologizes for his Autodesk call: It was 'a huge mistake',2018-09-04,Jim Cramer admits he misjudged the stock of Autodesk and issues apologies to the company's management and investors.
Cramer: Amazon's $1 trillion landmark is about more than just the company,2018-09-04,Jim Cramer says Amazon's growth and investor base helped propel the e-commerce giant to a $1 trillion market cap.
Cramer: Put the cloud kings on your shopping list for the Sepember slump,2018-09-04,"Jim Cramer recommends using market-wide pullbacks to buy shares of stocks like Adobe, Red Hat, Salesforce and Workday."
Cramer's lightning round: Don't give up on the sliding Schlumberger,2018-09-04,"Jim Cramer rattles off his take on callers' favorite stocks, including a longtime Cramer-fave oilfield services play."
Cramer Remix: Amazon's trillion-dollar valuation seems too low,2018-09-04,"Jim Cramer's telling you why Amazon looks cheap, even with its trillion-dollar valuation."
Cramer Remix: Lululemon still has more room to run,2018-09-05,Jim Cramer details why the standout retailer is worth buying into any weakness.
"Cramer's lightning round: Coupa Software is a buy, even up here",2018-09-05,"Jim Cramer flies through his take on callers' favorite stocks, including a cloud play that could be worth its current premium."
"Amazon is boosting Honeywell's business 'at the right time,' Honeywell CEO says",2018-09-05,Jim Cramer hears from Honeywell Chairman and CEO Darius Adamczyk on Honeywell's latest brushes with tech and trade.
"This will be seen as 'the lost decade of retailers,' RH CEO says",2018-09-05,Jim Cramer sits down with RH Chairman and CEO Gary Friedman at the company's newest gallery to discuss e-commerce and RH's transformation.
Cramer breaks down market rotations and what they mean for investors,2018-09-05,Jim Cramer digs into the concept of sector rotations and explains how investors can use them to refine their portfolios.
Cramer on what's causing the tech sell-off: It's 'all about mechanics',2018-09-06,Jim Cramer says institutional money moving in and out of stocks is the primary reason for widespread losses in the technology sector.
Cramer Remix: The critics predicting the death of online advertising are just wrong,2018-09-06,Jim Cramer explains how ad revenue will keep flowing to social media despite Congressional hearings and Wall Street naysayers.
Comcast CEO's biggest disappointment on Fox deal fallout was what it said about Comcast,2018-09-06,"Jim Cramer hears from Brian Roberts, the chairman and CEO of NBCUniversal parent Comcast, who speaks to his company's dealmaking and the era of connectivity."
Cramer's lightning round: Anheuser Busch doesn't look attractive because I think we're past beer,2018-09-06,Jim Cramer zooms through his take on fans' favorite stocks in a special edition of the lightning round.
Cramer's top stock picks for his 'fantasy portfolio' draft,2018-09-06,Jim Cramer celebrates the start of football season by building a fantasy football-style portfolio for investors.
"Cramer Remix: Don't own this entire sector, just the best of breed",2018-09-07,Jim Cramer explains why he thinks Home Depot and Lowe's will trounce Floor & Decor in the home improvement sector.
Cramer's lightning round: Buy Urban Outfitters if it gets hit on Monday,2018-09-07,"Jim Cramer shares his take on callers' favorite stocks, including an apparel retailer with a strong track record."
"10 years after recession, here's how fintech giant S&P Global is hedging against another one",2018-09-07,Jim Cramer sits down with S&P Global President and CEO Douglas Peterson to discuss how his financial services and ratings giant has changed its ways since 2008.
Cramer's game plan: Be ready for another Trump tariff-fueled sell-off,2018-09-10,Jim Cramer lays out his game plan for the week ahead and warns of potential market weakness after the president's latest warning to China.
Cramer's lightning round: Don't block the 'freight train' that is Skyworks Solutions' stock,2018-09-11,"Jim Cramer zips through his take on callers' favorite stocks, including a chipmaker that's having trouble picking up the pieces."
Cramer pinpoints the key to AMD's success: Its massive end market,2018-09-11,"Jim Cramer breaks down what's going right at Advanced Micro Devices, a semiconductor company going up against Intel and Nvidia."
Cramer: Stocks heavily tied to China may be signaling an end to the trade war,2018-09-11,Jim Cramer argues that the action in stocks like Honeywell suggests that China could soon give in to the United States' trade demands.
"Millennials are marrying later, but that's not exactly bad for homebuilders, Toll Brothers CEO says",2018-09-11,"Jim Cramer sits down with Toll Brothers CEO Douglas C. Yearley, Jr. to hear his take on trends in the U.S. housing market."
Cramer Remix: It's unclear why the auto sector is as weak as it is,2018-09-11,Jim Cramer digs through what could be causing the auto stocks to weaken even though the economy is growing.
Cramer Remix: This Fortnite play is not worth the temptation,2018-09-12,Jim Cramer explains why gaming headset maker Turtle Beach is too risky after its big move.
Cramer's lightning round: I'm not the call on how to play Roku,2018-09-12,"Jim Cramer rattles off his take on callers' favorite stocks, including a streaming play that he's gotten wrong in the past."
"Cramer introduces 'cloud princes,' the riskier, faster-growing versions of cloud kings",2018-09-12,Jim Cramer highlights several speculative cloud stocks for investors who can afford to take some risks in their portfolios.
Cramer: The surge in oil prices could reverse the oil-and-gas bear market,2018-09-12,"Jim Cramer sees a ""big problem"" in the U.S. energy market. Wednesday's oil price boost could help curb it."
Cramer finds ways to invest in the rise of small business optimism,2018-09-12,"Jim Cramer flags ways for investors to play small business optimism, which hit a record all-time high in August."
Cramer: The Apple Watch is like 'the gateway drug' to Apple's whole ecosystem,2018-09-13,Jim Cramer doubles down on his praise of Apple after the iPhone maker reveals its newest line of devices.
A 'super cell tower' in the stratosphere: AeroVironment and SoftBank's 5G vision,2018-09-13,Jim Cramer sits down with AeroVironment President and CEO Wahid Nawabi to hear about the drone maker's joint venture with SoftBank.
"Cramer's lightning round: GE may have bottomed, but it's still a wait-and-see story",2018-09-13,"Jim Cramer flies through his take on callers' favorite stocks, including an industrial at the top of investors' minds."
"Cramer's game plan: In a controversial week, leave room for strategy",2018-09-14,Jim Cramer outlines his game plan for the week ahead and tells investors how to navigate potential trade- and stock-related controversy.
Cramer: Wingstop's 'world domination' plan makes this restaurant stock a buy on weakness,2018-09-14,Jim Cramer says Wingstop's global expansion goals make the fast-food wing restaurant's stock attractive on a pullback.
"Cramer's lightning round: Out 3 to 5 years, 'wild trader' Spotify is attractive",2018-09-14,"Jim Cramer zooms through his take on callers' favorite stocks, including a subscription economy play on which Cramer's taking a long-term view."
Cramer Remix: Apple's new products prove its trillion-dollar valuation is too low,2018-09-14,Jim Cramer explains why Apple's sustained innovation is what keeps driving its stock higher.
"Cramer Remix: When it comes to trade, ignore Treasury Secretary Mnuchin",2018-09-14,Jim Cramer explains why it's best to disregard the top Trump advisor when it comes to China.
"Barstool Sports founder and CEO discuss company's Yelp-like pizza app, One Bite",2018-09-14,Jim Cramer sits down with Barstool Sports founder Dave Portnoy and CEO Erika Nardini to hear about the multimedia company's recent push into pizza.
Cramer: China's stock market wouldn't be tumbling if the US was losing the trade war,2018-09-17,Jim Cramer points out the difference in market performance in China and the United States and ties it to the trade war fears that are rattling investors.
Cramer Remix: A pullback in these stocks is a gift to investors,2018-09-17,Jim Cramer reveals the big opportunity behind the decline in medical device stocks.
Cramer's lightning round: I prefer the stock of Wendy's to McDonald's,2018-09-17,"Jim Cramer zips through his take on callers' favorite stocks, including a fast-food play that's seen better days."
"Lemonis doubles down on long-term view for Camping World, says No. 1 asset is loyalty club",2018-09-17,"Jim Cramer sits down with Camping World Holdings Chairman and CEO Marcus Lemonis, who recently bought 25,000 shares of his company as a vote of confidence."
"Expect the US dollar to strengthen further, says Daryl Guppy",2018-09-18,"Daryl Guppy of Guppytraders.com also says there appears to be a ""reluctance"" to let the Chinese yuan move much beyond the 7 level. "
Cramer: Wall Street short-sellers are losing because they're overestimating the trade war,2018-09-18,Jim Cramer says hedge fund managers are looking at the U.S.-China trade war the wrong way.
"Cramer: Vans could be the next major 'lifestyle brand' after Nike, Adidas",2018-09-18,"Jim Cramer says apparel giant VF Corp. has struck gold in Vans, its fast-growing subsidiary that could be the next Nike."
"With Caviar, Square is trying to bring the 'omnichannel' experience to restaurants: CFO",2018-09-18,"Jim Cramer hears from Square CFO Sarah Friar, who explains how her company leverages small business data to make transactions more seamless."
Cramer Remix: Why China has much more to lose in a trade war,2018-09-18,Jim Cramer explains how China's manufacturing-based economy leaves it vulnerable to U.S. trade tariffs.
"Cramer's lightning round: With those fundamentals, I can't recommend GameStop here",2018-09-18,"Jim Cramer shares his take on callers' favorite stocks at lightning speed, including a video-game retailer that could soon be acquired."
"Investing in cannabis is 'a great hedge' for alcohol and drug companies, Tilray CEO says",2018-09-19,Jim Cramer sits down with Tilray CEO Brendan Kennedy to get his take on the future of medical and recreational marijuana.
Cramer: 'Don't get ahead of yourself' with red-hot cannabis stocks like Tilray,2018-09-19,Jim Cramer asks investors to curb their enthusiasm when it comes to the marijuana market.
Cramer says it's 'highly unlikely' tariff costs will all trickle down to consumers,2018-09-20,Jim Cramer points to the action in retail stocks as a sign that the economic windfall from the U.S.-China trade spat won't affect U.S. consumers as much as people think.
Cramer: 'People are too excited' about pot stocks Eit will end badly',2018-09-20,"Jim Cramer doubles down on his warning about investing in marijuana stocks like Tilray, which has been trading wildly since CEO Brendan Kennedy's appearance on ""Mad Money."""
"'We're ahead of the pack' in the cannabinoid drug space, says CEO of synthetic drugmaker Corbus",2018-09-20,"Jim Cramer sits down with Yuval Cohen, the CEO of a company that is creating treatments derived from manmade cannabinoids for rare diseases like cystic fibrosis."
Cramer's lightning round: Snap 'really screwed up'—I can't recommend the stock,2018-09-20,"Jim Cramer flies through his take on callers' favorite stocks, including a high-profile social media play."
Cramer Remix: This rally could be 'built to last',2018-09-20,Jim Cramer details what the rotation out of growth and into value means for the bull market.
Cramer Remix: The biggest mistake you can make with taxes on your stock market winnings,2018-09-20,Jim Cramer revealed his top rule when it comes to taxes and selling stocks.
Cramer's lightning round: Don't get speculative with oil and gas stocks,2018-09-21,"Jim Cramer zooms through his take on callers' favorite stocks, including a small independent energy play that he wouldn't recommend to investors."
Cramer's game plan: Internalizing tariffs and getting ahead of good quarters,2018-09-21,Jim Cramer shares his game plan for the week ahead and explains why tariffs may not weigh on stocks as much as investors think.
"Red Hat CEO: 'We expect this is the bottom' in enterprise growth, it should re-accelerate",2018-09-21,"Jim Cramer hears from Red Hat President and CEO Jim Whitehurst, who addresses his company's second-quarter revenue miss."
"'We've got to wake up' to the very real threat of cybercrime, cybersecurity CEO says",2018-09-21,"Jim Cramer sits down with Q6 Cyber founder and CEO Eli Dominitz, who says companies that think their mission is to stop attacks in real time are ""dead wrong."""
Cramer Remix: These two factors could be enormous for Micron,2018-09-21,Jim Cramer explains how a demand for Micron's chips combined with its buyback could send the company soaring.
Cramer Remix: Patience is key in today's market,2018-09-24,Jim Cramer makes a case for maintaining a long-term outlook in this market.
Cramer's lightning round: Oil refiner Total is a winner in this environment,2018-09-24,"Jim Cramer shares his take on callers' favorite stocks at lightning speed, including an oil play that's benefiting from the current market layout."
Jamie Dimon on 2020 rumors: 'I don't think I would be good at' being president,2018-09-24,"Jim Cramer sits down with J.P. Morgan Chase & Co. Chairman and CEO Jamie Dimon, who speaks to the current political climate, why he won't run and his vision for government."
Cramer: 'Call me a buyer' of Comcast's stock despite its drop after Sky win,2018-09-24,Jim Cramer defends Comcast's long-term track record despite the media giant's share drop in the wake of winning the bidding war for Sky.
Cramer advises staying away from animal health play Elanco at these levels,2018-09-24,"Jim Cramer says that while his ""humanization of pets"" thesis remains intact, the newly public Elanco Animal Health is not the way to play it."
Cramer Remix: Don't overthink—the oil rally is for real,2018-09-25,Jim Cramer explains why investors shouldn't let caution trick you into missing straightforward moves.
Cramer's lightning round: Tesla's stock is too much of a battleground for me,2018-09-25,"Jim Cramer rattles off his take on callers' favorite stocks, including a high-profile auto play with a heavy trading volume."
"Cramer: Right now, chipmakers represent the downside of disruption",2018-09-25,Jim Cramer breaks down the weakness in the semiconductor stock cohort.
Marc Benioff: We bought Time Magazine because 'business is the greatest platform for change',2018-09-25,"Jim Cramer hears from Salesforce.com co-founder, Chairman and co-CEO Marc Benioff, who explains why he and his wife purchased Time Magazine."
"'Every cyberattack is related to geopolitical conditions,' says CEO of cybersecurity play FireEye",2018-09-25,"Jim Cramer gets the latest on cybersecurity from FireEye CEO Kevin Mandia, whose company was hired by Google to defend against state-sponsored cyberattacks."
Salesforce CEO on Apple partnership: 'I have Apple in my veins',2018-09-26,"Jim Cramer sits down with Salesforce.com chief Marc Benioff, who speaks to his company's newly forged deal with Apple."
Cramer cautions against trading stocks every time Fed chief 'opens his mouth',2018-09-26,Jim Cramer analyzes the Federal Reserve's latest interest rate hike and tells investors not to be worried about an economic slowdown.
"'We need to de-stress the travel lifestyle,' says CEO of United Airlines owner",2018-09-26,"Jim Cramer sits down with Oscar Munoz, the CEO of United Continental Holdings, to hear more about how the airline is trying to improve the customer experience."
Cramer: Winterwear maker Canada Goose is 'best of the bunch' in recovering retail sector,2018-09-26,Jim Cramer explains why investors are circling back to retail stocks and shares his top picks in the space.
Cramer Remix: This auto retailer is missing the mark on Wall Street's latest trend,2018-09-27,Jim Cramer is breaking down how personalization is hurting CarMax's profitability.
Cisco CEO says Silicon Valley companies 'have to care' about issues like homelessness,2018-09-27,Jim Cramer gets an exclusive read on Cisco Systems' recent projects and deals in an interview with Chairman and CEO Chuck Robbins.
CEO of cloud company Box says tech industry needs '21st-century' regulation,2018-09-27,"Jim Cramer sits down with Box co-founder and CEO Aaron Levie, who speaks to the importance of data protection and explains his reasons for backing big tech regulation."
Cramer: This year's 'investable theme' is product personalization,2018-09-27,Jim Cramer explains how personalization has become synonymous with the digital revolution as demonstrated by companies like Salesforce and Nike.
"Cramer's lightning round: If you're going to own an insurance stock, buy Chubb",2018-09-27,"Jim Cramer breezes through his take on callers' favorite stocks, including an insurance play that could be one-upped by a Cramer fave."
"Cramer Remix: This stock is like Tesla, except it's making money",2018-09-28,Jim Cramer applauds Stitch Fix's profitable approach to personalization thanks to its CEO.
Cramer's game plan: A busy week ahead of a make-or-break report,2018-09-28,"Jim Cramer flags key stocks and events in the week ahead, including a Labor Department report that could prompt a sell-off."
Cramer: What stands out in Elon Musk's SEC conflict 'is his hubris',2018-09-28,"Jim Cramer shares his take on ""cult stock"" Tesla following news of CEO Elon Musk being sued by the Securities and Exchange Commission."
"Cramer's lightning round: 'I've been wrong' on Groupon, 'but I'm not backing away'",2018-09-28,"Jim Cramer flies through his take on callers' favorite stocks, including a discount retail play with an e-commerce twist."
"ServiceNow CEO: We want work technology to be just as easy as eBay, PayPal, Uber",2018-09-28,"Jim Cramer sits down with ServiceNow President and CEO John Donahoe to hear how the leader of the ""cloud king"" is trying to simplify the way we do work."
Cramer Remix: The upcoming election may impact this stock,2018-10-01,Jim Cramer warns investors that Grand Canyon Education could be impacted by a political party change in Congress.
Cramer's lightning round: Under Armour has bottomed; it's a buy,2018-10-01,"Jim Cramer zips through his take on callers' favorite stocks, including an athletic retail play that could be on the cusp of a rally."
Cramer: 'Think twice before you sell' shares of companies competing with Amazon,2018-10-01,"Jim Cramer revisits some ""Amazon survivors"" to prove that the Death Star's competition doesn't always mean total annihilation."
Cramer on SurveyMonkey IPO: 'I worry that it might be a dinosaur',2018-10-01,"Jim Cramer advises against investing in SurveyMonkey, a nearly 20-year-old software company that's new to the public market."
Cramer: GE's CEO change could mean the company is doing worse than expected,2018-10-01,"Jim Cramer says that while General Electric's CEO replacement was a win for the stock, it could mean the company's situation is more dire than previously thought."
Cramer flags the two tailwinds sending the stock market to record highs,2018-10-02,Jim Cramer says employment trends and a stock shortage have allowed the stock market to continue its extended climb.
Cramer explains why GE's board really booted former CEO John Flannery,2018-10-02,Jim Cramer argues that the former General Electric CEO wasn't removed because of the speed of his turnaround.
Cramer: Charts show 'old-school' chip stocks like Intel ready to roar,2018-10-02,Jim Cramer and Carolyn Boroden inspect the charts of some key semiconductor stocks and determine that investors may see quicker gains by buying the more established plays.
Cramer's lightning round: Now is not the time to buy cloud stocks—wait for a dip,2018-10-02,"Jim Cramer rattles off his take on callers' favorite stocks, including a cloud play that's been experiencing some stormy weather."
Cramer Remix: Worrying about these stocks is a waste of time,2018-10-02,"Jim Cramer reveals why you shouldn't worry about TJX, Ross, and Burlington   E  and why they should even be bought into weakness."
Cramer says 'Fed should be careful what it wishes for' with wage inflation,2018-10-03,Jim Cramer wonders if the Federal Reserve needs to step on the brakes so methodically in a growing economy with seemingly healthy inflation.
Cramer Remix: Amazon is still one of the most powerful deflationary forces on Earth,2018-10-03,"Jim Cramer explains why despite its wage increase, Amazon is working harder than ever to keep prices down."
Cramer: Beware the bears' warnings on global markets—they could lead you astray,2018-10-03,Jim Cramer warns investors not to take market pessimists too seriously when they warn that financial trouble overseas could affect U.S. stocks.
"Cramer: Between Western Digital and Micron, Micron's stock is the one worth owning",2018-10-03,Jim Cramer breaks down the declines in shares of chipmakers Western Digital and Micron and explains why he thinks Micron is more valuable.
Cramer reveals the 10 'telltale signs' that could prolong the sell-off,2018-10-04,Jim Cramer flags the various ways the stock market could continue its broad-based sell-off.
"Canopy investment 'has nothing to do with' our core business, Constellation Brands CEO says",2018-10-04,Jim Cramer hears from Constellation Brands CEO Rob Sands about his company's investment in cannabis producer Canopy Growth.
